{"run_date":"2026-10-25","asof":"2026-10-25","model_version":"0.4.1","last_poll_date":"2026-10-22","n_polls":50,"candidates":[{"candidate_id":"le_pen_marine","p_qualify":0.8251,"p_win":0.7163,"first_round_share":{"q05":16.1,"q25":24.8,"q50":31.1,"q75":38.1,"q95":49.4}},{"candidate_id":"philippe_edouard","p_qualify":0.2657,"p_win":0.1082,"first_round_share":{"q05":5.4,"q25":9.2,"q50":12.6,"q75":16.8,"q95":25.3}},{"candidate_id":"bardella_jordan","p_qualify":0.1109,"p_win":0.0876,"first_round_share":{"q05":15.2,"q25":23.6,"q50":29.9,"q75":37.1,"q95":48.7}},{"candidate_id":"glucksmann_raphael","p_qualify":0.24,"p_win":0.0531,"first_round_share":{"q05":4.7,"q25":8.3,"q50":11.4,"q75":15.4,"q95":23.9}},{"candidate_id":"melenchon_jean_luc","p_qualify":0.4881,"p_win":0.0091,"first_round_share":{"q05":6.8,"q25":11.4,"q50":15.3,"q75":20.0,"q95":29.3}},{"candidate_id":"retailleau_bruno","p_qualify":0.0226,"p_win":0.0068,"first_round_share":{"q05":2.2,"q25":4.0,"q50":5.7,"q75":8.1,"q95":13.1}},{"candidate_id":"bertrand_xavier","p_qualify":0.0051,"p_win":0.0041,"first_round_share":{"q05":1.1,"q25":2.4,"q50":3.9,"q75":6.1,"q95":11.4}},{"candidate_id":"attal_gabriel","p_qualify":0.015,"p_win":0.0033,"first_round_share":{"q05":2.0,"q25":3.7,"q50":5.3,"q75":7.7,"q95":13.7}},{"candidate_id":"lisnard_david","p_qualify":0.0047,"p_win":0.0032,"first_round_share":{"q05":1.7,"q25":3.1,"q50":4.5,"q75":6.4,"q95":10.4}},{"candidate_id":"lassalle_jean","p_qualify":0.0066,"p_win":0.0027,"first_round_share":{"q05":0.8,"q25":1.8,"q50":3.0,"q75":4.9,"q95":9.8}},{"candidate_id":"placeholder_centre","p_qualify":0.0035,"p_win":0.0017,"first_round_share":{"q05":2.8,"q25":5.3,"q50":7.4,"q75":10.3,"q95":16.4}},{"candidate_id":"de_villiers_philippe","p_qualify":0.0021,"p_win":0.0006,"first_round_share":{"q05":1.2,"q25":2.5,"q50":4.0,"q75":6.2,"q95":11.5}},{"candidate_id":"zemmour_eric","p_qualify":0.0039,"p_win":0.0005,"first_round_share":{"q05":1.5,"q25":2.6,"q50":3.5,"q75":4.8,"q95":7.5}},{"candidate_id":"tondelier_marine","p_qualify":0.001,"p_win":0.0005,"first_round_share":{"q05":0.8,"q25":1.6,"q50":2.3,"q75":3.3,"q95":5.6}},{"candidate_id":"ruffin_francois","p_qualify":0.001,"p_win":0.0003,"first_round_share":{"q05":1.1,"q25":2.0,"q50":2.9,"q75":4.1,"q95":6.8}},{"candidate_id":"de_villepin_dominique","p_qualify":0.0006,"p_win":0.0003,"first_round_share":{"q05":0.7,"q25":1.4,"q50":2.1,"q75":3.2,"q95":5.7}},{"candidate_id":"bompard_manuel","p_qualify":0.0005,"p_win":0.0003,"first_round_share":{"q05":1.5,"q25":2.7,"q50":4.0,"q75":5.8,"q95":10.2}},{"candidate_id":"roussel_fabien","p_qualify":0.0006,"p_win":0.0002,"first_round_share":{"q05":0.7,"q25":1.3,"q50":1.9,"q75":2.7,"q95":4.8}},{"candidate_id":"hollande_francois","p_qualify":0.0005,"p_win":0.0002,"first_round_share":{"q05":1.5,"q25":2.6,"q50":3.7,"q75":5.2,"q95":8.8}},{"candidate_id":"arthaud_nathalie","p_qualify":0.0004,"p_win":0.0002,"first_round_share":{"q05":0.2,"q25":0.4,"q50":0.7,"q75":1.1,"q95":2.2}},{"candidate_id":"dupont_aignan_nicolas","p_qualify":0.0006,"p_win":0.0001,"first_round_share":{"q05":0.6,"q25":1.2,"q50":1.7,"q75":2.4,"q95":4.1}},{"candidate_id":"polony_natacha","p_qualify":0.0003,"p_win":0.0001,"first_round_share":{"q05":0.3,"q25":0.8,"q50":1.4,"q75":2.4,"q95":4.9}},{"candidate_id":"platret_gilles","p_qualify":0.0002,"p_win":0.0001,"first_round_share":{"q05":0.3,"q25":0.8,"q50":1.4,"q75":2.3,"q95":4.8}},{"candidate_id":"asselineau_francois","p_qualify":0.0003,"p_win":0.0001,"first_round_share":{"q05":0.2,"q25":0.6,"q50":1.1,"q75":2.0,"q95":4.1}},{"candidate_id":"cazeneuve_bernard","p_qualify":0.0001,"p_win":0.0001,"first_round_share":{"q05":0.2,"q25":0.5,"q50":0.8,"q75":1.4,"q95":3.1}},{"candidate_id":"batho_delphine","p_qualify":0.0001,"p_win":0.0001,"first_round_share":{"q05":0.2,"q25":0.5,"q50":0.9,"q75":1.5,"q95":3.1}},{"candidate_id":"becht_olivier","p_qualify":0.0001,"p_win":0.0001,"first_round_share":{"q05":0.2,"q25":0.6,"q50":1.0,"q75":1.7,"q95":3.7}},{"candidate_id":"kazib_anasse","p_qualify":0.0001,"p_win":0.0001,"first_round_share":{"q05":0.2,"q25":0.6,"q50":1.0,"q75":1.8,"q95":3.8}},{"candidate_id":"bouamrane_karim","p_qualify":0.0001,"p_win":0.0001,"first_round_share":{"q05":0.1,"q25":0.3,"q50":0.6,"q75":1.0,"q95":2.1}},{"candidate_id":"philippot_florian","p_qualify":0.0001,"p_win":0.0,"first_round_share":{"q05":0.2,"q25":0.5,"q50":0.9,"q75":1.6,"q95":3.3}},{"candidate_id":"knafo_sarah","p_qualify":0.0001,"p_win":0.0,"first_round_share":{"q05":1.4,"q25":2.6,"q50":3.6,"q75":5.2,"q95":8.6}},{"candidate_id":"labib_selma","p_qualify":0.0001,"p_win":0.0,"first_round_share":{"q05":0.2,"q25":0.6,"q50":1.0,"q75":1.8,"q95":3.7}},{"candidate_id":"poutou_philippe","p_qualify":0.0,"p_win":0.0,"first_round_share":{"q05":0.1,"q25":0.4,"q50":0.8,"q75":1.4,"q95":3.2}}]}
