{"run_date":"2026-08-17","asof":"2026-08-17","model_version":"0.0.0-mock","last_poll_date":"2026-08-14","n_polls":30,"candidates":[{"candidate_id":"le_pen_marine","p_qualify":0.8503,"p_win":0.443,"first_round_share":{"q05":17.9,"q25":22.2,"q50":25.8,"q75":30.1,"q95":36.7}},{"candidate_id":"philippe_edouard","p_qualify":0.5283,"p_win":0.3017,"first_round_share":{"q05":9.4,"q25":13.2,"q50":16.5,"q75":19.8,"q95":24.5}},{"candidate_id":"bardella_jordan","p_qualify":0.125,"p_win":0.0777,"first_round_share":{"q05":18.6,"q25":24.8,"q50":28.4,"q75":32.7,"q95":39.2}},{"candidate_id":"melenchon_jean_luc","p_qualify":0.2743,"p_win":0.0717,"first_round_share":{"q05":8.8,"q25":11.6,"q50":13.8,"q75":16.4,"q95":20.8}},{"candidate_id":"glucksmann_raphael","p_qualify":0.1037,"p_win":0.042,"first_round_share":{"q05":7.1,"q25":9.6,"q50":11.7,"q75":14.1,"q95":17.7}},{"candidate_id":"attal_gabriel","p_qualify":0.0693,"p_win":0.039,"first_round_share":{"q05":5.9,"q25":7.9,"q50":9.6,"q75":12.7,"q95":19.6}},{"candidate_id":"placeholder_centre","p_qualify":0.041,"p_win":0.022,"first_round_share":{"q05":14.3,"q25":16.2,"q50":18.6,"q75":20.3,"q95":23.1}},{"candidate_id":"retailleau_bruno","p_qualify":0.0073,"p_win":0.0027,"first_round_share":{"q05":5.2,"q25":7.1,"q50":8.5,"q75":10.2,"q95":13.1}},{"candidate_id":"bompard_manuel","p_qualify":0.0007,"p_win":0.0003,"first_round_share":{"q05":5.7,"q25":7.3,"q50":8.7,"q75":10.3,"q95":13.3}},{"candidate_id":"hollande_francois","p_qualify":0,"p_win":0,"first_round_share":{"q05":2.9,"q25":4.2,"q50":5,"q75":5.9,"q95":7.5}},{"candidate_id":"tondelier_marine","p_qualify":0,"p_win":0,"first_round_share":{"q05":2.5,"q25":3.3,"q50":4,"q75":4.9,"q95":6.3}},{"candidate_id":"de_villepin_dominique","p_qualify":0,"p_win":0,"first_round_share":{"q05":2.1,"q25":2.8,"q50":3.6,"q75":4.5,"q95":5.9}},{"candidate_id":"zemmour_eric","p_qualify":0,"p_win":0,"first_round_share":{"q05":2.3,"q25":2.9,"q50":3.5,"q75":4.2,"q95":5.4}},{"candidate_id":"bertrand_xavier","p_qualify":0,"p_win":0,"first_round_share":{"q05":1.7,"q25":2.3,"q50":2.9,"q75":3.7,"q95":8.1}},{"candidate_id":"ruffin_francois","p_qualify":0,"p_win":0,"first_round_share":{"q05":1.8,"q25":2.4,"q50":2.9,"q75":3.5,"q95":4.6}},{"candidate_id":"lassalle_jean","p_qualify":0,"p_win":0,"first_round_share":{"q05":1.5,"q25":2.1,"q50":2.9,"q75":4.1,"q95":5.3}},{"candidate_id":"lisnard_david","p_qualify":0,"p_win":0,"first_round_share":{"q05":1.7,"q25":2.3,"q50":2.9,"q75":3.9,"q95":8.5}},{"candidate_id":"roussel_fabien","p_qualify":0,"p_win":0,"first_round_share":{"q05":1.5,"q25":2,"q50":2.5,"q75":3.1,"q95":4}},{"candidate_id":"cazeneuve_bernard","p_qualify":0,"p_win":0,"first_round_share":{"q05":1.5,"q25":2,"q50":2.5,"q75":3,"q95":3.9}},{"candidate_id":"knafo_sarah","p_qualify":0,"p_win":0,"first_round_share":{"q05":1.5,"q25":1.8,"q50":2.2,"q75":2.6,"q95":3.9}},{"candidate_id":"polony_natacha","p_qualify":0,"p_win":0,"first_round_share":{"q05":1,"q25":1.4,"q50":2,"q75":3.4,"q95":4.8}},{"candidate_id":"asselineau_francois","p_qualify":0,"p_win":0,"first_round_share":{"q05":0.9,"q25":1.4,"q50":1.9,"q75":3.8,"q95":4.9}},{"candidate_id":"dupont_aignan_nicolas","p_qualify":0,"p_win":0,"first_round_share":{"q05":1.1,"q25":1.5,"q50":1.8,"q75":2.1,"q95":2.8}},{"candidate_id":"de_villiers_philippe","p_qualify":0,"p_win":0,"first_round_share":{"q05":0.8,"q25":1.1,"q50":1.3,"q75":1.5,"q95":1.9}},{"candidate_id":"arthaud_nathalie","p_qualify":0,"p_win":0,"first_round_share":{"q05":0.6,"q25":0.8,"q50":1,"q75":1.2,"q95":1.6}},{"candidate_id":"batho_delphine","p_qualify":0,"p_win":0,"first_round_share":{"q05":0.6,"q25":0.8,"q50":1,"q75":1.2,"q95":1.7}},{"candidate_id":"becht_olivier","p_qualify":0,"p_win":0,"first_round_share":{"q05":0.5,"q25":0.7,"q50":1,"q75":1.3,"q95":2.5}},{"candidate_id":"poutou_philippe","p_qualify":0,"p_win":0,"first_round_share":{"q05":0.7,"q25":0.8,"q50":0.9,"q75":1.1,"q95":1.3}},{"candidate_id":"philippot_florian","p_qualify":0,"p_win":0,"first_round_share":{"q05":0.5,"q25":0.7,"q50":0.8,"q75":1,"q95":1.3}},{"candidate_id":"bouamrane_karim","p_qualify":0,"p_win":0,"first_round_share":{"q05":0.4,"q25":0.6,"q50":0.7,"q75":0.8,"q95":1.2}},{"candidate_id":"kazib_anasse","p_qualify":0,"p_win":0,"first_round_share":{"q05":0.3,"q25":0.4,"q50":0.5,"q75":0.7,"q95":0.9}},{"candidate_id":"platret_gilles","p_qualify":0,"p_win":0,"first_round_share":{"q05":0.3,"q25":0.4,"q50":0.5,"q75":0.7,"q95":5.6}},{"candidate_id":"labib_selma","p_qualify":0,"p_win":0,"first_round_share":{"q05":0.2,"q25":0.3,"q50":0.4,"q75":0.4,"q95":0.6}}]}
